review_id,review,review_tokenized,topic,score,topic_title,rating
15,"ไม่ค่อยประทับใจค่ะครั้งนี้ แอบผิดหวัง:(
‘Menya Itto’ เอราวัณ
ร้านราเมงที่ชั้น G ตึกเอราวัณค่ะ
เดิมทีเคยมากินร้านนี้ตั้งแต่เปิดใหม่ๆเลย ตอนนั้นคนเยอะมาก
มาตั้งแต่ร้านเปิดช่วงมื้อเย็น นั่งรอแพร๊พนึงไม่นานก็ได้เข้า
จำได้ว่ารสชาติมันเค็มเข้มข้นดี วันนั้นน่าจะเจอเจ้าของร้านด้วย
มาสวัสดีขอบคุณที่มากินที่ร้านอยู่เลย

พอดีวันนี้อยู่ๆก็อยากกินราเมงขึ้นมา ละก็ไม่ได้มาร้านนี้นานแล้ว
เลยตัดสินใจมากินกันค่ะ:)

ถ้าจะมากินร้านนี้ สามารถจอดรถได้ที่ตึกเอราวัณเลยค่ะ
ละมาปั๊มบัตรจอดรถได้ที่ร้านอาหารเลย

วันนี้เอ๊ะมากัน 4คนค่ะ เลยสั่งมาคนละอย่างเลย
มาอย่างหิวกันเลย เริ่มต้นที่ ‘เกี๊ยวซ่า’ ค่ะ
เป็นเกี๊ยวซ่าทอด มา 5ชิ้นเล็กๆ ถ้าหิวมากๆ คนเดียวก็หมดนะคะ ฮ่าๆ
ชิ้นพอดีคำเลย แป้งบางใช้ได้ แต่ไส้ค่อนข้างน้อยค่ะ
น้ำจิ้มตามมาตรฐาน สำหรับจานนี้รสชาติถือว่าใช้ได้ค่ะ

‘Chashu Itto Tsukemen’ 350฿
ชามนี้ทางร้านขึ้นชื่อว่าเป็น signature เลยนะคะ
ชามนี้จะเสิร์ฟเป็นเส้นแบบหนากว่าชามอื่นค่ะ มาแบบเย็น
พร้อมน้ำซุป ซึ่งเป็นน้ำซุปที่เคี่ยวจากไก่ ปลา กุ้ง และหอยเชลล์
เคี่ยวนานถึง 18ชม.เชียวนะ ออกมาละรสชาติออกทางเข้มข้น
และค่อนข้างเค็มเลยค่ะ เวลากินจะกินแบบหมี่เย็นเลย จิ้มจุ่มซูด
ละน้ำซุปเข้มข้นที่มาเนี่ย เราจะสามารเติมน้ำซุปใส
ซึ่งทางร้านเตรียมใส่เหยือกไว้ที่โต๊ะแล้วลงไปเพื่อเจือจางได้อีกค่ะ
ซึ่งจะสามารถทำให้เราซดได้คล่องคอมากขึ้น
เซตนี้มีเนื้อหมูมาให้ และมีลูกชิ้นหมูสับมาในน้ำซุป
และมีพริกบ่นมาคู่ด้วย
รสชาติเข้มข้นมากถึงขั้นเค็มเลยค่ะวันนี้ เส้นแข็งไปหน่อย
ตัวหมูวันนี้ไม่ค่อยอร่อยเท่าไร เนื้อหมูนิ่มจริง แต่ไม่ค่อยมีรสชาติเลยค่ะ

‘Chashu Noko Gyokai Ramen’ 240฿
ชามนี้เป็นลัการะน้ำซุปเข้มข้น เส้นนิ่มกว่าชามแรกค่ะ เค็มไม่เท่า
มีกลิ่นปลาแห้ง (ซีฟู๊ต) ค่อนข้างแรงหน่อย
เนื้อหมูและไก่ก็ถือว่าไม่ค่อยอร่อยเหมือเดิมค่ะ
ค่อนข้างผิดหวัง

‘Chashu Shio Ramen’ 280฿
อันนี้ราเมงรสเกลือค่ะ เส้นนิ่มหน่อย น้ำซุปใสๆ กินง่าย
เนื้อหมูและไก่ก็ถือว่าไม่ค่อยอร่อยเหมือเดิมค่ะ
ชามนี้ถือว่าดีสุดในทั้งหมด 3ชามค่ะ

‘ข้าวหน้าหมูชาชูไข่ออนเซ็น’
ชามนี้ชิมไปคำนึงค่ะ คุณพ่อกินจานนี้บอกว่าอร่อยดีนะคะ
ชิมเองละส่วนตัวคิดว่าหวานไปหน่อย แต่ถือว่าโอเคอยู่นะคะ

สิ่งที่เอ๊ะชอบที่สุดในวันนี้ คือ ไข่ต้ม ค่ะ
ทำมาได้ดี สุกกำลังดี และรสชาติเค็มนิดๆ อร่อยดีค่ะ

สรุปว่าร้านนี้เอ๊ะไม่ค่อยประทับใจเลยค่ะ
รสชาติเปลี่ยนไปจากวันแรกที่เคยกิน
คิดว่าคงมารอบนี้ละพอละค่ะ:)","ประทับใจ,แอบ,ผิดหวัง,:(,Menya,Itto,เอราวัณ,ราเมง,ชั้น,G,ตึก,เอราวัณ,เดิมที,กิน,ตอนนั้น,คน,มื้อ,เย็น,นั่ง,รอ,แพ,ร๊พ,นึง,จำได้,รสชาติ,เค็ม,เข้มข้น,ดี,เจอ,เจ้าของร้าน,สวัสดี,ขอบคุณ,ที่มา,กินที่,อยู่เลย,กิน,ราเมง,ตัดสิน,ใจมา,กินกัน,:),กิน,จอด,รถ,ตึก,เอราวัณ,ละมา,ปั๊ม,บัตรจอดรถ,ร้านอาหาร,เอ๊ะ,คน,สั่ง,คนละอย่าง,หิว,เริ่มต้น,เกี๊ยวซ่า,เกี๊ยวซ่า,ทอด,ชิ้น,หิว,คนเดียว,นะคะ,ฮ่า,ชิ้น,แป้ง,ใช้ได้,ไส้,ข้างน้อย,น้ำจิ้ม,มาตรฐาน,สำหรับ,จาน,รสชาติ,ใช้ได้,Chashu,Itto,Tsukemen,ชาม,ขึ้นชื่อว่า,signature,นะคะ,ชาม,เสิร์ฟ,เส้น,หนา,ชาม,เย็น,น้ำ,ซุป,เป็นน้ำ,ซุป,เคี่ยว,ไก่,ปลา,กุ้ง,หอย,เชลล์,เคี่ยว,ชม.,เชียว,ออกมา,รสชาติ,เข้มข้น,เค็ม,เวลา,กิน,กิน,หมี่,เย็น,จิ้ม,จุ่ม,ซูด,น้ำ,ซุป,เข้มข้น,ที่มา,สา,มาร,เติม,น้ำ,ซุป,ใส,เตรียม,ใส่,เหยือก,โต๊ะ,เจือจาง,ซด,คล่องคอ,มากขึ้น,เซต,เนื้อหมู,ลูกชิ้น,หมูสับ,น้ำ,ซุป,พริก,บ่น,คู่,รสชาติ,เข้มข้น,ถึงขั้น,เค็ม,เส้นแข็ง,ตัว,หมู,อร่อย,เนื้อหมู,นิ่ม,รสชาติ,Chashu,Noko,Gyokai,Ramen,ชาม,ลัก,า,ระ,น้ำ,ซุป,เข้มข้น,เส้น,นิ่ม,ชาม,เค็ม,กลิ่น,ปลา,แห้ง,ซี,ฟู๊ต),แรง,เนื้อหมู,ไก่,อร่อย,เห,มือ,เดิม,ผิดหวัง,Chashu,Shio,Ramen,อันนี้,ราเมง,รส,เกลือ,เส้น,นิ่ม,น้ำ,ซุป,ใส,กิน,เนื้อหมู,ไก่,อร่อย,เห,มือ,เดิม,ชาม,ดี,ชาม,ข้าว,หน้า,หมู,ชาชู,ไข่,ออน,เซ็น,ชาม,ชิม,คำนึง,คุณพ่อ,กิน,จาน,บอ,อร่อย,ดี,นะคะ,ชิม,ส่วนตัว,หวาน,โอเค,นะคะ,เอ๊ะ,ชอบ,ไข่ต้ม,ทำ,ได้ดี,สุก,กำลังดี,รสชาติ,เค็ม,อร่อย,ดี,สรุป,เอ๊ะ,ประทับใจ,รสชาติ,เปลี่ยนไป,กิน,รอบ,:)",0,0.99977183,foodie review,2
16,"คุณภาพตกจนน่ากลัว
ราคาต่อหัว: 251 - 500 บาท
เมนูเด็ด: TsukemenNoodles
จากใจคนชอบทาน Ramen
เมือก่อนตอนมาไทยแรกๆ Menya Itto ดีกว่านี้มากๆ 30-50%
ตอนนี้รู้สึกรสชาติตกลงไปเยอะ

น้ำซุปเข้มข้นที่ทำมาวันนี้ เค็มมาก มันไม่มีมิติ ความมันกลมกล่อมเหมือนสูตรเดิมหลงเหลือเลย

ส่วนเส้น ร้านนี้ทำได้ดีอยู่ละ น่าจะเป็นเส้นนำเข้ามา
หมูก็มาตรฐาน ปานกลาง
ลูกชิ้นเนื้อไก่ก็ปานกลาง

ผมให้เหลือ 1 ดาวเพราะมาตรฐานตกไปเยอะ จาก 3-4 ดาว

มันไม่มีเสน่ห์หลงเหลือแล้ว
ส่วนที่จอดรถ รร Erawan หมุนรถต้องระวังครับ โค้งแคบมาก
อารมณ์ รร เก่า 30 ปีอัพ","คุณภาพ,ตก,น่ากลัว,ราคา,เมนู,เด็ด,Tsukemen,Noodles,ใจ,คน,ชอบ,ทาน,Ramen,เมือ,ตอน,ไทย,Menya,Itto,ดีกว่า,%,ตอนนี้,รู้สึก,รสชาติ,ตกลง,น้ำ,ซุป,เข้มข้น,ทำ,เค็ม,มิติ,ความมัน,กลมกล่อม,เหมือน,สูตร,เดิม,หลงเหลือ,เส้น,ทำ,ได้ดี,น่าจะเป็น,เส้น,เข้ามา,หมู,มาตรฐาน,ปานกลาง,ลูกชิ้น,เนื้อไก่,ปานกลาง,ผม,ดาว,มาตรฐาน,ตกไป,ดาว,มีเสน่ห์,หลงเหลือ,ที่จอดรถ,รร,Erawan,หมุน,รถ,ระวัง,โค้ง,แคบ,อารมณ์,รร,เก่า,ปี,อัพ",2,0.99911666,user experiances,1
17,เค็มมากกกกกกกกกกกก ทาน Chashu shio ramen เค็มมากกกกกก หมูชาชูนุ่มดี แต่นั่งได้โต๊ะละคนนะคะ ไม่เหมาะกับมากับเพื่อนฝูงของเด็ด: ChashuShioRamen,"เค็ม,กก,กก,กก,กก,กก,กก,ทาน,Chashu,shio,ramen,เค็ม,กก,กก,กก,หมู,ชาชู,นุ่ม,ดี,นั่ง,โต๊ะ,คน,นะคะ,เหมาะกับ,เพื่อนฝูง,เด็ด,ChashuShioRamen",2,0.99777967,user experiances,3
18,"
ร้านนี้เป็นร้านราเมนเจ้าดังมาก เค้าบอกกันว่าเป็นร้านราเมนอันดับ 1 ในโตเกียว 🇯🇵 และได้มาเปิดสาขาที่กรุงเทพ (เพิ่งเปิดเมื่อ เดือน กรกฎาคม 2560) คนต่อคิวกันเต็มเพื่อให้ได้กินราเมนอันโด่งดัง
Itto Noko Gyokai Tsukemen ลองสั่งเมนนูนี้มาทาน เป็นกานทานราเมนแบบเอาเส้นราเมนที่ลวกแห้งมา จุ่มกับน้ำซุปราเมนที่ใส่มาแยกถ้วย ความอร่อยอยู่ตรงน้ำซุปสำหรับจุ่มเส้นราเมน ที่มีความเข้มข้น แบบญี่ปุ่นมาก แต่พอทานไปมากๆเจอกับลิ้นคนไทยก็อาจเลี่ยนได้ ส่วนเนื้อหมูชาชู ไก่ ที่ใส่มา รสชาติค่อนข้างจืด โดยรวมแล้วรสชาติ อาจอร่อยสำหรับคนญี่ปุ่น แต่สำหรับคนไทยอาจจะยังไม่ค่อยชินในรสชาติแบบนี้
เกี้ยวซ่า รลชาติค่อนข้างจืดมาก","ราเมน,เจ้า,เค้า,ราเมน,อันดับ,โตเกียว,🇯🇵,สาขา,กรุงเทพ,เดือน,กรกฎาคม,คน,คิว,เต็ม,ให้ได้,กิน,ราเมน,โด่งดัง,Itto,Noko,Gyokai,Tsukemen,ลอง,สั่ง,เมน,นู,ทาน,กาน,ทาน,ราเมน,เส้น,ราเมน,ลวก,แห้ง,จุ่ม,น้ำ,ซุป,ราเมน,ใส่,แยก,ถ้วย,อร่อย,น้ำ,ซุป,สำหรับ,จุ่ม,เส้น,ราเมน,เข้มข้น,ญี่ปุ่น,ทาน,เจอ,ลิ้น,คนไทย,เลี่ยน,เนื้อหมู,ชาชู,ไก่,ใส่,รสชาติ,จืด,โดยรวม,รสชาติ,อร่อย,สำหรับ,คนญี่ปุ่น,สำหรับ,คนไทย,ชิน,รสชาติ,แบบนี้,เกี้ยว,ซ่า,รล,ชาติ,จืด",2,0.9992095,user experiances,3
19,"เส้นสึเคเมนเหนียวนุ่มอร่อยกับซุปไก่รสชาติเข้มข้นกลมกล่อม ที่สำคัญเค็มกำลังพอดี

เรื่องราวของร้านนี้ไม่มีอะไรมาก ก็คือเป็นร้านราเมนที่ได้อันดับ 1 ในเว็บไซต์ Tabelog ที่เป็นเว็บรีวิวร้านอาหารจากผู้ใช้งานเหมือนกับเว็บ Wongnai ของไทยนี่แหละ สาขาที่ญี่ปุ่นเห็นว่าต้องต่อคิวยาวเกือบครึ่งชั่วโมง ส่วนสาขานี้ที่ไทยเพิ่งเปิดใหม่ยังไม่ถึงเดือน เห็นว่าคิวยาวเหมือนกันถ้าเป็นตรงเวลามื้ออาหารพอดี

มื้อนี้ผมมาตอน 2 ทุ่มกว่า มีคนรออยู่ 2 คิวก่อนหน้า แต่โชคดีได้โต๊ะทันที แต่รออาหารนานเหมือนกัน

ร้านอยู่ชั้นใต้ดินของโรงแรมเอราวัณ แต่สามารถเดินเข้าจากทางฝั่งถนนพระราม 1 ได้เลย อยู่ตรงปากทางเข้าพอดีเด๊ะ

[ เมนูที่สั่ง ]
- Itto Noko Gyokai Tsukemen (350.-) เป็นเมนูที่เป็น signature ของร้าน ถ้ามาร้านนี้ยังไงก็ควรจะสั่งเมนูนี้เป็นอย่างแรก เส้นสึเคเมนเหนียวหนึบเคี้ยวมัน จุ่มกับน้ำซุปที่ร้านนี้ใช้เป็นซุปไก่รสชาติเข้มข้นที่ร้านบอกว่าเคี่ยวมาเป็นสิบชั่วโมง ความมันไม่มันมากและความเค็มก็กำลังพอดี (แต่ถ้ารู้สึกเค็มไปก็เติมซุป Wadashi ให้เจือจางลงได้) จะเสิร์ฟมาพร้อมกับพริกถ้วยเล็กๆ (มันคือน้ำพริกแห้งๆ ที่ทำจากกุ้งนี่แหละ) ผมลองใส่พริกแล้วไม่ค่อยเวิร์ค แนะนำว่าไม่ใส่จะดีกว่า ... เนื้อที่ให้มามี 3 อย่างคือ Bara Chashu (Pork belly), Rosu Chashu (Pork sholder) แล้วก็ Tori Chashu (เนื้อไก่) ซึ่งเนื้อจะถูกซูวีมาก่อนทำให้นุ่มเป็นพิเศษ เท่าที่กินมื้อนี้ผมว่าผมชอบ Rosu Chashu มากสุด

- ไข่ต้ม Tamago (35.-) ต้มมาแบบปรุงรสมาอย่างดี รสชาติเข้มข้นอร่อย แนะนำให้สั่งครับ

มื้อนี้ลองเฉพาะเมนูสึเคเมนอย่างเดียว 350 บาท ก็ถือว่าราคาสูงนะเพราะยังต้อง ++ อีก ถ้าราคาเบาลงกว่านี้ก็คงจะดี ... เพื่อนที่เคยกินสาขาที่ญี่ปุ่นบอกว่ารสชาติต่างกัน และเนื้อที่ใส่มาในสึเคเมนที่สาขาที่ญี่ปุ่นจะต่างไป (เห็นเพื่อนคุยกันว่าน่าจะเป็นเพราะที่ญี่ปุ่นได้มีการปรับเปลี่ยนสูตรไปจากสูตรดั้งเดิมพอสมควรแล้ว แต่พอมาเปิดที่ไทย เลยใช้สูตรดั้งเดิมก่อน) แต่ผมไม่ซีเรียสเรื่องที่ไม่เหมือนกัน ขอเทียบเฉพาะกับร้านในไทยพอครับ

เมื่อก่อนร้านสึเคเมนที่ชอบจะเป็นร้าน Nidaime Tsujita ที่อยู่ในโซน Ramen Champion ที่ Arena 10 (ที่ญี่ปุ่นร้านนี้ไม่ได้ดังอะไรมาก) ร้านนั้นเส้นสึเคเมนจะใหญ่และเคี้ยวมันกว่านี้ ส่วนน้ำซุปจะสู้ร้านนี้ไม่ได้ แต่ที่สำคัญกว่าคือร้านปิดไปแล้ว ... มีร้านนี้มาเปิดแล้วทำให้ได้ร้านสึเคเมนที่ชอบและอยากมากินอีกเรื่อยๆ กลับมาแล้ว สรุปแล้วคือ ดีกรีร้านราเมงอันดับ 1 ที่ญี่ปุ่น พอมาไทยก็ยังเป็นร้านที่เยี่ยมเช่นกัน","เส้น,สึ,เค,เมน,เหนียว,นุ่ม,อร่อย,ซุป,ไก่,รสชาติ,เข้มข้น,กลมกล่อม,เค็ม,เรื่องราว,ราเมน,อันดับ,เว็บไซต์,Tabelog,เว็บ,รีวิว,ร้านอาหาร,ผู้ใช้งาน,เหมือนกับ,เว็บ,Wongnai,ไทย,สาขา,ญี่ปุ่น,คิว,ครึ่ง,ชั่วโมง,สาขา,ไทย,เดือน,คิว,เหมือนกัน,ตรงเวลา,มื้อ,อาหาร,มื้อ,ผม,ตอน,ทุ่ม,คน,รอ,คิว,โชคดี,โต๊ะ,รอ,อาหาร,เหมือนกัน,ชั้นใต้ดิน,โรงแรม,เอราวัณ,เดิน,ฝั่ง,ถนน,พระราม,ปาก,ทางเข้า,เด๊ะ,[,เมนู,สั่ง,],Itto,Noko,Gyokai,Tsukemen,เมนู,signature,ควรจะ,สั่ง,เมนู,เส้น,สึ,เค,เมน,เหนียวหนึบ,เคี้ยว,จุ่ม,น้ำ,ซุป,ซุป,ไก่,รสชาติ,เข้มข้น,บอ,เคี่ยว,สิบ,ชั่วโมง,ความมัน,ความเค็ม,รู้สึก,เค็ม,เติม,ซุป,Wadashi,เจือจาง,เสิร์ฟ,พริก,ถ้วย,น้ำพริก,แห้ง,ทำ,กุ้ง,ผม,ลอง,ใส่,พริก,เวิร์ค,แนะนำ,ใส่,ดีกว่า,...,เนื้อที่,Bara,Chashu,Pork,belly,),,Rosu,Chashu,Pork,sholder,แล้วก็,Tori,Chashu,เนื้อไก่,เนื้อ,ซู,วี,นุ่ม,เป็นพิเศษ,กิน,มื้อ,ผม,ผม,ชอบ,Rosu,Chashu,ไข่ต้ม,Tamago,ต้ม,ปรุงรส,ดี,รสชาติ,เข้มข้น,อร่อย,แนะนำ,สั่ง,มื้อ,ลอง,เมนู,สึ,เค,เมน,ราคา,ราคา,เบา,ดี,...,เพื่อน,กิน,สาขา,ญี่ปุ่น,บอ,รสชาติ,ต่างกัน,เนื้อที่,ใส่,สึ,เค,เมน,สาขา,ญี่ปุ่น,เพื่อน,คุย,น่าจะเป็น,ญี่ปุ่น,ปรับเปลี่ยน,สูตร,สูตร,ดั้งเดิม,ไทย,สูตร,ดั้งเดิม,ผม,ซีเรียส,เรื่อง,เหมือนกัน,เทียบ,ไทย,สึ,เค,เมน,ชอบ,Nidaime,Tsujita,ที่อยู่,โซน,Ramen,Champion,Arena,ญี่ปุ่น,เส้น,สึ,เค,เมน,เคี้ยว,น้ำ,ซุป,สู้,...,ทำ,ให้ได้,สึ,เค,เมน,ชอบ,กิน,กลับมา,สรุป,ดีกรี,ราเมง,อันดับ,ญี่ปุ่น,ไทย,เยี่ยม",2,0.9997386,user experiances,4
