review_id,review,review_tokenized,topic,score,topic_title,rating
1,"No.1 from Tokyo
เมนูเด็ด: Chashu Noko Gyokai Ramen, เกี๊ยวซ่า
ร้านตั้งอยู่ชั้น 3 ห้าง Gaysorn Village เรามาสองคนสั่ง 3 อย่าง
1. Shio Ramen (250฿) น้ำซุปไก่เคี่ยวกับซีฟู้ด รสชาติกลมกล่อม เสิร์ฟพร้อมชาชูไก่ สันคอหมู หน่อไม้และสาหร่าย 1 แผ่น
2. Chashu Noko Gyokai Ramen (265฿) น้ำซุปข้นกว่า Shio ramen เสิร์ฟพร้อมอกไก่ สันคอหมู และหมูสามชั้น อร่อยดี
3. เกี๊ยวซ่า 5 ชิ้น (100฿) เมนูซิกเจอร์ของร้าน แป้งด้านนอกกรอบกัดเข้าไปด้านใน juicey สมแล้วที่ได้แรงบันดาลใจมาจากเสี่ยวหลงเปา","No,from,Tokyo,เมนู,เด็ด,Chashu,Noko,Gyokai,Ramen,,,เกี๊ยวซ่า,ตั้งอยู่,ชั้น,ห้าง,Gaysorn,Village,สอง,คน,สั่ง,Shio,Ramen,น้ำ,ซุป,ไก่,เคี่ยว,ซี,ฟู้ด,รสชาติ,กลมกล่อม,เสิร์ฟ,ชาชู,ไก่,สัน,คอ,หมู,หน่อไม้,สาหร่าย,แผ่น,Chashu,Noko,Gyokai,Ramen,น้ำ,ซุป,ข้น,Shio,ramen,เสิร์ฟ,อกไก่,สัน,คอ,หมู,หมูสามชั้น,อร่อย,ดี,เกี๊ยวซ่า,ชิ้น,เมนู,ซิก,เจอร์,แป้ง,ด้านนอก,กรอบ,กัด,เข้าไป,ด้านใน,juicey,สม,แรงบันดาลใจ,มาจาก,เสี่ยว,หลง,เปา",0,0.9992545,foodie review,4
2,"สุดยอดราเมงร้านโปรดในไทย

เมนูเส้นๆนี่เดลิเวอรี่ไม่ได้จริงๆ ยิ่งราเมงนี่ยิ่งหนักเลย ร้านนี้คอราเมงน่าจะรู้จักกันดีอยู่แล้ว ร้านดังจากย่าน Shin Koiwaในโตเกียว คะแนนดีทุกสำนัก คนเยอะ คิวยาวทุกวัน สาขาที่ไทยอยู่ชั้น B1 โรงแรมเอราวัณ

ร้านนี้เค้าโด่งดังเรื่อง ""Tsukemen"" ของดีจริง ไปชิมที่ญี่ปุ่นมาแล้วติดใจ ยกให้เป็นมาตรฐานซึเคะเม็งในใจเลย เส้นเด้ง ซุปดี เครื่องอร่อย กินรวมกันเลิศมาก

Itto tsukemen 270฿++
เมนูเด็ดของร้าน ราเมงแยกเส้นแบบจิ้มจุ่ม เส้นใหญ่หนึบๆทำจากแป้งสาลีผสมจมูกข้าวๆ ซุปรสชาติเข้มข้นจากโครงไก่ ปลาทะเล กุ้งซากุระ และหอยเชลล์
เครื่องเป็นหมูชาชูซูวีนุ่มๆ กินเส้นหมดแล้วก็เติมซุป wadashiเพื่อลดความเข้มข้น ซดเป็นซุปปิดท้าย

ไม่ได้มากินนาน ยังอร่อยเหมือนเดิม ซึเคะเม็งแบบนี้เค้าไม่ซดซุประหว่างจุ่มเส้นกันนะ เดี๋ยวไตจะวาย รอเติม wadashiก่อน แนะนำให้รีบกินตอนซุปยังร้อนๆ สูดเส้นรับกลิ่นรสของน้ำซุป เส้นเด้งๆแบบนี้คือทีเด็ดของราเมงอร่อยๆ พอทำให้หายคิดถึงญี่ปุ่นไปได้","สุดยอด,ราเมง,โปรด,ไทย,เมนู,เส้น,เด,ลิ,เวอ,รี่,ราเมง,หนัก,คอ,ราเมง,รู้จัก,ดี,อยู่แล้ว,ย่าน,Shin,Koiwa,โตเกียว,คะแนน,ดี,สำนัก,คน,คิว,สาขา,ไทย,ชั้น,B,โรงแรม,เอราวัณ,เค้า,โด่งดัง,เรื่อง,"",Tsukemen,"",ดีจริง,ชิม,ญี่ปุ่น,ติดใจ,มาตรฐาน,ซึเคะ,เม็ง,ใจ,เส้น,เด้ง,ซุป,ดี,เครื่อง,อร่อย,กิน,เลิศ,Itto,tsukemen,฿++,เมนู,เด็ด,ราเมง,แยก,เส้น,จิ้ม,จุ่ม,เส้นใหญ่,หนึบ,ทำ,แป้งสาลี,ผสม,จมูกข้าว,ซุป,รสชาติ,เข้มข้น,โครง,ไก่,ปลา,ทะเล,กุ้ง,ซากุระ,หอย,เชลล์,เครื่อง,หมู,ชาชู,ซู,วี,นุ่ม,กินเส้น,แล้วก็,เติม,ซุป,wadashi,ลด,เข้มข้น,ซด,ซุป,ปิดท้าย,กิน,อร่อย,เหมือนเดิม,ซึเคะ,เม็ง,แบบนี้,เค้า,ซด,ซุป,จุ่ม,เส้น,เดี๋ยว,ไต,วาย,รอ,เติม,wadashi,แนะนำ,รีบ,กิน,ตอน,ซุป,ร้อน,สูด,เส้น,กลิ่น,รส,น้ำ,ซุป,เส้น,เด้ง,แบบนี้,ทีเด็ด,ราเมง,อร่อย,หาย,คิดถึง,ญี่ปุ่น",0,0.99959105,foodie review,5
3,"ราเมงอันดับ1จากญี่ปุ่น
Menya Itto ร้านราเมงที่ได้อันดับ 1 ในเว็ปของ Tabelogซึ่งเป็นร้านที่มีชื่อเสียงมากในประเทศญี่ปุ่น ส่วนสาขาที่ไทย ได้ย้ายจากโรงแรมเอราวัณ มาเปิดที่ Gaysorn Village แทนแล้ว ร้านใหม่จะดูโปร่ง โล่งสบายกว่าเดิม เมนูชื่อดังของร้านก็จะเป็นTsukemen
เมนูแนะนำ
Coq au Vin Tsukemen(490) ส่วนตัวเป็นคนที่ชอบTsukemen มาก อันนี้เป็นเมนูใหม่ของร้าน รสชาติไม่เหมือนราเมงที่เคยทานมาก่อนเลย เหมือนเป็นการผสมผสานกันระหว่างญี่ปุ่นและฝรั่งเศส ตัวน้ำซุปจะมีการผสมไวน์ลงไปด้วย ทำให้ได้รสชาติที่เข้มข้น คล้ายๆดื่มไวน์ไป ทานอาหารไป ส่วนตัวไก่ จะเป็นไก่ตัวผู้ ซึ่งเนื้อจะมีรสชาติที่เข้มข้นและนุ่มหนึบ รีบไปลองก่อนของจะหมดน้า
Gyutan Donburi (490) ข้าวหน้าลิ้นวัว ลิ้นวัวเนื้อนุ่มมาก จะมีทั้งส่วนที่เป็นย่าง รมควัน และตุ๋น อร่อยทั้ง2แบบ เวลาทานให้จิ้มไปในซอสไข่ดอง จะเพิ่มความมันๆ นัวๆเข้าไปอีก ตัดเลี่ยนด้วยวาซาบินิดนึง","ราเมง,อันดับ,ญี่ปุ่น,Menya,Itto,ราเมง,อันดับ,เว็ป,Tabelog,มีชื่อเสียง,ในประเทศ,ญี่ปุ่น,สาขา,ไทย,ย้าย,โรงแรม,เอราวัณ,Gaysorn,Village,แทน,ดู,โปร่ง,โล่ง,เดิม,เมนู,ชื่อดัง,Tsukemen,เมนู,แนะนำ,Coq,au,Vin,Tsukemen,ส่วนตัว,คน,ชอบ,Tsukemen,อันนี้,เมนู,รสชาติ,เหมือน,ราเมง,ทาน,เหมือน,ผสมผสาน,ญี่ปุ่น,ฝรั่งเศส,ตัว,น้ำ,ซุป,ผสม,ไวน์,ทำ,ให้ได้,รสชาติ,เข้มข้น,คล้ายๆ,ดื่ม,ไวน์,ทานอาหาร,ส่วนตัว,ไก่,ไก่,ตัวผู้,เนื้อ,รสชาติ,เข้มข้น,นุ่ม,หนึบ,รีบ,ลอง,น้า,Gyutan,Donburi,ข้าว,หน้า,ลิ้น,วัว,ลิ้น,วัวเนื้อ,นุ่ม,ย่าง,รมควัน,ตุ๋น,อร่อย,เวลา,ทาน,จิ้ม,ซอส,ไข่,ดอง,ความมัน,นัว,เข้าไป,ตัด,เลี่ยน,วาซาบิ,นิดนึง",2,0.99938685,user experiances,4
4,"เค็มนำ รสชาติแปลก เกี๊ยวซ่าดี ชาเขียวดีมีแมลงในแก้วด้วย สะดุดพอสมควร แพงไปหน่อย
เกริ่นก่อน คือ หิวมากก แล้วเป็นสายเตี๋ยวโดยเฉพาะ
เวลาคนหิวๆกินอะไรก็น่าจะอร่อย

เมนูที่ร้านมีไม่เยอะ แต่คิดไว้ว่าน่าจะ ว้าว!
เอิ่ม..ก็ว้าว! จริงตั้งแต่คำแรก แต่ตรงกันข้าม -*-

คือเส้นเหนียว หนา เคี้ยวแล้วคล้ายเส้นยากิโซบะ พอกินได้..
เส้นแบนๆแบบหมี่เป๊าะก็เหมือนจะดี อยู่ในซุปแบบราดหน้าเหนียวๆ รสชาติแปลกกก เค็มนำ เติมซุปได้ฟรี แต่เติมแล้วจืดเลย รสชาติยังแปลกอยู่ดี เนื้อชิ้นใหญ่ให้สมราคาแต่จืด

ข้าวชาชู หน้าตาดูดี แต่รสชาติไม่ถึง เหมือนหมักไม่เข้าเนื้อ

ขนมหวาน น้ำตาลหนาไปหน่อยเลยแข็ง ส่วนซอสด้านในหวานเกินไป

น้ำชาเขียว ชาดีชาแบบออกขมๆหน่อย แต่ความสะอาดไม่ค่อย
เพราะเจอแมลงในแก้วค่ะ ดีนะเจอตอนทานเสร็จแล้ว

ไม่งั้นได้อ้วกแน่ๆ บอกพนักงานๆก็แค่เปลี่ยนมาให้ แล้วบอกว่า แมลงอาจจะบินมาตกลงตอนคุณลูกค้าทานอาหาร ห๊ะ!! (เหมือนว่าชั้นผิดที่เจอ) เริ่ด!!

ส่วนตัวคิดว่าราคาค่อนข้างสูงเกินคุณภาพ

สุดท้ายก็ทนกิน เพราะหิวมากๆ อุตส่าห์เดินมาไกล ผิดหวัง","เค็ม,รสชาติ,แปลก,เกี๊ยวซ่า,ดี,ชาเขียว,ดี,แมลง,แก้ว,สะดุด,แพง,เกริ่น,หิว,กก,สาย,เตี๋ยว,โดยเฉพาะ,เวลา,คน,หิว,กิน,อร่อย,เมนู,ว้าว,!,เอิ่ม..,ว้าว,!,ตรงกันข้าม,*,เส้น,เหนียว,หนา,เคี้ยว,เส้น,ยา,กิ,โซ,บะ,กิน,..,เส้น,แบน,หมี่,เป๊าะ,เหมือน,ดี,ซุป,ราดหน้า,เหนียว,รสชาติ,แปลก,กก,เค็ม,เติม,ซุป,ฟรี,เติม,จืด,รสชาติ,แปลก,อยู่ดี,เนื้อ,ชิ้น,สมราคา,จืด,ข้าว,ชาชู,หน้าตา,ดูดี,รสชาติ,เหมือน,หมัก,เข้าเนื้อ,ขนมหวาน,น้ำตาล,หนา,แข็ง,ซอส,ด้านใน,หวาน,เกินไป,น้ำ,ชาเขียว,ชา,ดี,ชา,ขม,ความสะอาด,เจอ,แมลง,แก้ว,ดี,เจอ,ตอน,ทาน,ไม่งั้น,อ้วก,แน่ๆ,พนักงาน,บอ,แมลง,บิน,ตกลง,ตอน,ลูกค้า,ทานอาหาร,ห๊ะ!!,เหมือนว่า,ชั้น,ผิดที่,เจอ,เริ่ด,!!,ส่วนตัว,ราคา,คุณภาพ,สุดท้าย,ทน,กิน,หิว,อุตส่าห์,เดิน,ผิดหวัง",0,0.9995549,foodie review,1
5,"วันก่อนไปธุระที่เกษร ก็เลยแวะทานราเมนร้านดัง Menya Itto ซะหน่อย

เราไม่ใช่สายราเมนค่ะ (ไม่ค่อยชอบกินก๋วยเตี๋ยวอยู่แล้ว และราเมนมักจะมีแต่แป้ง) แต่นานๆกินทีก็โอเค

เราสั่ง shio ramen และให้เค้าลดเค็มให้ด้วยค่ะ น้ำซุปที่ซดไปคำแรกคืออร่อยมากเลย หอม และรสชาติกำลังดี เส้นก็กำลังดีเลยค่ะ และชาชูที่นี่มันน้อยกว่าที่อื่น และยังมีอกไก่อีก เลยเหมือนว่าจะเป็นราเมนที่ ไม่ unhealthy เท่าไหร่นะ

ส่วนคุณนายสั่ง tsukemen เมนูเด็ดของร้าน นางว่าอร่อย แต่เราลองชิมแล้วเราว่าเค็มไปมาก น้ำซุปจะข้นๆ และเส้นอวบๆ เราว่ากินแล้วคล้ายๆขนมจีนไหหลำอยู่เหมือนกันนะคะ

ส่วนเกี๊ยวซ่า ดีงามตามรีวิวจริงๆ แป้งบางและไส้ฉ่ำๆ ดีมากเลยค่ะ","วันก่อน,ธุระ,เก,ษร,แวะ,ทาน,ราเมน,Menya,Itto,สาย,ราเมน,ชอบ,กิน,ก๋วยเตี๋ยว,อยู่แล้ว,ราเมน,แป้ง,กิน,โอเค,สั่ง,shio,ramen,เค้า,ลด,เค็ม,น้ำ,ซุป,ซด,อร่อย,หอม,รสชาติ,กำลังดี,เส้น,กำลังดี,ชาชู,ที่นี่,ที่อื่น,ยังมี,อกไก่,เหมือนว่า,ราเมน,unhealthy,คุณนาย,สั่ง,tsukemen,เมนู,เด็ด,อร่อย,ลอง,ชิม,เค็ม,น้ำ,ซุป,ข้น,เส้น,อวบ,กิน,คล้ายๆ,ขนมจีน,ไหหลำ,เหมือนกัน,นะคะ,เกี๊ยวซ่า,ดีงาม,รีวิว,แป้ง,ไส้,ฉ่ำ,ดีมาก",1,0.99906266,ramen lover,4
6,"The Best Tsukemen in Bangkok (พค 2022 ย้ายมา Gaysorn ชั่วคราว)

เมนูเด็ด: Chashu Itto Tsukemen
เวลาอยากกิน Tsukemen ที่ดีในกรุงเทพ ร้านนี้จะเป็นร้านที่นึกถึงเสมอ สั่งเมนูประจำ Chashu Itto Tsukemen จะได้บะหมี่เย็น พร้อมเนื้อ 3 แบบกับน้ำซุปร้อนแยกกันอีกถ้วย

วิธีทานคือเอาบะหมี่เย็นไปจุ่มน้ำร้อน แล้วตามด้วยท็อปปิ้งจุ่มในรอบต่อไป แล้วก็ทานสลับไปมา เป็นเอกลักษณะของราเมนประเภทนี้

ปกติร้านจะอยู่ที่ Erawan แต่ตอนนี้ทางห้างปิดรีโนเวตชั่วคราว เลยย้ายมาอยู่ที่ Gaysorn Tower โซนตึกใหม่ ชั้น 3 ตรงข้าม nabezo ครับ","The,Best,Tsukemen,in,Bangkok,(พค,ย้าย,Gaysorn,ชั่วคราว,เมนู,เด็ด,Chashu,Itto,Tsukemen,เวลา,กิน,Tsukemen,ดี,กรุงเทพ,นึกถึง,เสมอ,สั่ง,เมนู,ประจำ,Chashu,Itto,Tsukemen,บะหมี่,เย็น,เนื้อ,น้ำ,ซุป,ร้อน,แยกกัน,ถ้วย,วิธี,ทาน,บะหมี่,เย็น,จุ่ม,น้ำร้อน,ท็อป,ปิ้ง,จุ่ม,รอบ,ต่อไป,แล้วก็,ทาน,สลับ,ไปมา,เอก,ลักษณะ,ราเมน,ประเภท,ปกติ,Erawan,ตอนนี้,ห้าง,รี,โน,เวต,ชั่วคราว,ย้าย,Gaysorn,Tower,โซน,ตึก,ชั้น,ตรงข้าม,nabezo",2,0.9991419,user experiances,4
7,"หนึ่งในร้านราเมนที่คนรักราเมนคิดถึง โดยเฉพาะ สึเคเมน
แถมร้านยังออกเมนูใหม่ๆมาให้fc ลองชิมได้ตลอด

วันนี้ไปลองเมนูพิเศษฉลองตรุษจีน Awabi Tsukemen (690.-)
ทางร้านบอกว่าเมนูได้แรงบันดาลใจจาก Pen Cai ตำรับกวางตุ้ง ที่เอาเป๋าฮื้อกับหอยเชลล์ดิบๆมาไว้ด้วยกัน แล้วราดด้วยตับเป๋าฮื้อ ยุซุและพริกซันโช น่าสนใจมากๆ

แถมรอบนี้ ตัวเส้นแบบ Hosomen เป็นเส้นเล็กเรียวลงกมาได้พอดีมากๆ เข้ากันดีกับซุปที่เป็นเบสไก่ไพตัน ผสมวัตถุดิบทะเลหลายชนิด หอยเป๋าฮื้อ โฮตาเตะ และกุ้ง เข้มข้นมากๆ แต่เค็มน้อยกว่าชามปกตินะ ใส่โฮตาเตะเล็กมาให้อีกด้วย

อีกชามที่เพิ่งเคยสั่ง คือ Chashu Shio ramen (280.-) ซุปเบสไก่กลิ่นชัดๆ ข้นกว่าที่อื่นนิดนึง ผสมผสานเกลือทะเล เส้นเล็กเด้ง แฟนเราชอบมาก ส่วนตัวไม่ชอบกลิ่นซุปไก่ชัดๆ ชอบทางใสๆสดชื่นๆมากกว่า แต่ถือว่าเป็นชามอร่อยของหลายคนเลยนะ

เกี๊ยวซ่า ยังคงครองใจเรา แม้ไม่ชอบน้ำจิ้มเค็มโดดแบบนี้ แต่เกี๊ยวซ่าอร่อยมาก จนไม่ต้องจิ้มมากเลย แป้งบางเหนียวเด้ง ไส้หอมต้นหอม รสชาติดี ทอดมากรอบนิดๆ พอดีคำ ชอบมากๆ ต้องสั่งทุกทีไป

สามารถจองโต๊ะๆด้ในappChope ล่วงหน้าอย่างน้อย 1 วัน

โทรจองเมนูพิเศษล่วงหน้าได้ เราโทรช่วง 11.00น. วันที่จะไปกินตลอด ","ราเมน,คนรัก,ราเมน,คิดถึง,โดยเฉพาะ,สึ,เค,เมน,แถม,เมนู,fc,ลอง,ชิม,ลอง,เมนู,พิเศษ,ฉลอง,ตรุษจีน,Awabi,Tsukemen,บอ,เมนู,แรงบันดาลใจ,Pen,Cai,ตำรับ,กวางตุ้ง,เป๋าฮื้อ,หอย,เชลล์,ดิบ,ราด,ตับ,เป๋าฮื้อ,ยุ,ซุ,พริก,ซัน,โช,น่าสนใจ,แถม,รอบ,ตัว,เส้น,Hosomen,เส้น,เรียว,ก,ดีมาก,เข้ากัน,ดี,ซุป,เบส,ไก่,ไพ,ตัน,ผสม,วัตถุดิบ,ทะเล,หลายชนิด,หอย,เป๋าฮื้อ,โฮ,ตา,เตะ,กุ้ง,เข้มข้น,เค็ม,ชาม,ปกติ,ใส่,โฮ,ตา,เตะ,อีกด้วย,ชาม,สั่ง,Chashu,Shio,ramen,ซุป,เบส,ไก่,กลิ่น,ชัด,ข้น,ที่อื่น,นิดนึง,ผสมผสาน,เกลือ,ทะเล,เส้น,เด้ง,แฟน,ชอบ,ส่วนตัว,ชอบ,กลิ่น,ซุป,ไก่,ชัด,ชอบ,ใส,สดชื่น,ชาม,อร่อย,คน,เกี๊ยวซ่า,ครองใจ,ชอบ,น้ำจิ้ม,เค็ม,โดด,แบบนี้,เกี๊ยวซ่า,อร่อย,ไม่ต้อง,จิ้ม,แป้ง,เหนียว,เด้ง,ไส้,หอม,ต้น,หอม,รสชาติ,ดี,ทอด,กรอบ,ชอบ,สั่ง,จอง,โต๊ะ,ๆด้,appChope,ล่วงหน้า,โทร,จอง,เมนู,พิเศษ,ล่วงหน้า,โทร,น.,ที่จะ,กิน",2,0.9995854,user experiances,5
