review_id,review,review_tokenized,topic,score,topic_title,rating
8,"ราเมนร้านดังจากโตเกียว

จำได้ว่าตอนร้านเปิดใหม่ๆ ตรงรอคิวนานมากทีเดียว เมนู signature ของทางร้านต้องเป็น Tsukemen ราเมนเส้นเย็นเสริฟ์แยกมากับน้ำซุปร้อน ตอนแรกก็ว่าจะสั่ง แต่พอเห็นเมนูราเมนวากิว เราก็แพ้ทางเลยทันทีเปลี่ยนใจ ขอสั่งเลย Clam Shoyu Ramen with Blackmore Wagyu MBS9+ (395) ราเมนในน้ำซุปไก่+หมู +หอยถึง 3 อย่าง Asari, Hamaguri และ Shijimi clams น้ำมันสกัดเห็ดพอร์ชินี่และโชยุที่ผ่านการบ่มรสชาติอยู่ในถังไม้ถึง 4 ปี น้ำซุปมีความหอมรสชาติกลมกล่อมเป็นเอกลักษณ์ โปะเนื้อวากิวสไลซ์ชิ้นใหญ่แผ่เต็มชาม อร่อยฟินมาก

ส่วนใครไม่อยากทานราเมน สั่งเป็นข้าวหน้าชาชูก็อร่อยนะ เป็นมิกซ์ชาชูหมูกับไก่หั่นเป็นลูกเต๋า ราดซอสเทริยากิโปะไข่ออนเซน สามารถเพิ่ม truffle paste ได้ด้วย เพิ่มอีก 100 บาท เพิ่มกลิ่นทรัฟเฟิลหอมๆ เข้าไปอีก

โดยรวมก็ยังชอบนะ อาจจะไม่ดูพลุกพล่านเหมือนแต่ก่อน แต่ก็มีลูกค้าทั้งคนและญี่ปุ่นแวะเวียนมาทานกันเรื่อยๆ","ราเมน,โตเกียว,จำได้,ตอน,รอ,คิว,เมนู,signature,Tsukemen,ราเมน,เส้น,เย็น,เส,ริฟ์,แยก,น้ำ,ซุป,ร้อน,ตอนแรก,สั่ง,เมนู,ราเมน,วา,กิว,แพ้ทาง,เปลี่ยนใจ,สั่ง,Clam,Shoyu,Ramen,with,Blackmore,Wagyu,MBS,ราเมน,น้ำ,ซุป,ไก่,หมู,หอย,Asari,,,Hamaguri,Shijimi,clams,น้ำมัน,สกัด,เห็ด,พอร์,ชิ,โช,ยุ,การบ่ม,รสชาติ,ถัง,ไม้,ปี,น้ำ,ซุป,หอม,รสชาติ,กลมกล่อม,เอกลักษณ์,โปะ,เนื้อ,วา,กิวสไลซ์,ชิ้น,แผ่,เต็ม,ชาม,อร่อย,ฟิน,ทาน,ราเมน,สั่ง,ข้าว,หน้า,ชาชู,อร่อย,มิกซ์,ชาชู,หมู,ไก่,หั่น,ลูกเต๋า,ราด,ซอส,เท,ริ,ยา,กิ,โปะ,ไข่,ออน,เซน,truffle,paste,กลิ่น,ทรัฟเฟิล,หอม,เข้าไป,โดยรวม,ชอบ,ดู,พลุกพล่าน,เหมือน,ลูกค้า,ญี่ปุ่น,แวะเวียน,ทาน",2,0.9994634,user experiances,4
9,"
ได้ยินชื่อเสียงของราเมนร้านนี้จากหลายๆท่านในวงใน
ว่าร้านนี้เคยได้อันดับ 1 ของเว็บ tabelog เว็บรีวิวอาหาร
ชื่อดังจากญี่ปุ่น ทำให้ดูน่าสนใจที่จะไปลองมาก
ร้านนี้อยู่ชั้น LG ตึก Erawan Hyatt Plaza ตรงด้านหน้า
ติดกับร้าน nara
เมนูที่ลองสั่งวันนี้เลยก็คือเมนู Itto Gyokai Tsukemon
ราเมนเย็นเสริฟแยกมากับน้ำซุปที่เข้มข้นมากๆ เส้นราเมน
เย็นมีความเหนียวนุ่มอร่อยมากกินคู่กับน้ำซุปที่ร้อนๆตัด
กันได้ดี น้ำซุปแอบมีความเค็มพอตัวต้องเติมน้ำซุปของที่
ร้านเพิ่มไปหน่อยค่อยลงตัวขึ้นมาเยอะ ในน้ำซุปก็มีหมูปั้น
อร่อยแซมมาด้วยซึ่งอร่อยดีเหมือนกัน ในชามยังมีหมูชาชู
มาอีกชิ้นกินเข้าคู่กันได้เป็นอย่างดี
โดยรวมแล้วก็อร่อยในระดับนึงแต่ไม่ถึงกับว้าวอะไร","ได้ยิน,ชื่อเสียง,ราเมน,ท่าน,วงใน,อันดับ,เว็บ,tabelog,เว็บ,รีวิว,อาหาร,ชื่อดัง,ญี่ปุ่น,ดู,น่าสนใจ,ที่จะ,ลอง,ชั้น,LG,ตึก,Erawan,Hyatt,Plaza,ด้านหน้า,ติดกับ,nara,เมนู,ลอง,สั่ง,เมนู,Itto,Gyokai,Tsukemon,ราเมน,เย็น,เส,ริ,ฟ,แยก,น้ำ,ซุป,เข้มข้น,เส้น,ราเมน,เย็น,ความเหนียว,นุ่ม,อร่อย,กิน,คู่,น้ำ,ซุป,ร้อน,ตัด,ได้ดี,น้ำ,ซุป,แอบ,ความเค็ม,เติม,น้ำ,ซุป,ลงตัว,น้ำ,ซุป,หมู,ปั้น,อร่อย,แซม,อร่อย,ดี,เหมือนกัน,ชาม,ยังมี,หมู,ชาชู,ชิ้น,กิน,เข้าคู่,ดี,โดยรวม,แล้วก็,อร่อย,ระดับ,นึง,ถึงกับ,ว้าว",1,0.9992564,ramen lover,3
10,คิวยังยาวอยู่มั้ยคะ เห็นคิวเยอะคนรอนานมาก กลัวจะไปรอเกอ ค่ะ,"คิว,คิว,คน,รอ,กลัว,รอ,เก,อ",0,0.99317265,foodie review,3
11,เห็นสีของหมูชมพู๊ชมพูค่ะ ไม่กล้ากิน ,"สี,หมู,ชม,พู๊,ชมพู,กล้า,กิน",1,0.990866,ramen lover,3
12,"จุดเด่นของร้านคือ เส้น Homemade และน้ำซุปสูตรเฉพาะของทางร้านค่ะ
แน่นอนว่าเราต้องลอง Signature ก่อนนะคะ

Tsukemen นี่มีป้ายบอกวิธีกินด้วยอ่ะ

เมนูนี้เลย Chashu Itto Tsukemen
เสิร์ฟแยกกันระหว่างซุปกับเส้น ตัวเส้นเป็นลักษณะหนานุ่ม Topping บนชามมี ไก่ชาชู หมูชาชู หมูสามชั้น และแผ่นสาหร่าย
น้ำซุปดูเข้มข้นมาก พร้อมลูกชิ้นไก่สับกับกระดูกอ่อน 2 ชิ้น

เวลากินคือจุ่มเส้นลงไปเลยจ้า
หากน้ำซุปเข้มข้นไป สามารถเติมน้ำซุปได้ค่ะ ซึ่งบนโต๊ะของทุกๆโต๊ะนั้นจะมีน้ำซุป ""Wadashi"" เอาไว้เติมค่ะ
ท็อปปิ้งมีให้เลือกสั่งเพิ่ม

แน่นอนว่าต้องสั่ง Tamako หรือ ไข่ต้มแช่ซอส มาใส่ในชามราเมงเพิ่มด้วยจ้า
ชิมแล้วบอกเลยว่าฟินมาก กับ Signature น้ำซุปรสเข้มข้นของชามนี้

มาลองเมนูใหม่กันบ้าง
""Mazemen"" 2 รสชาติ ราเมนโฮมเมดเส้นเล็ก เหนียว นุ่ม ตามสไตล์เมนยะอิตโตคลุกซอสสูตรพิเศษขลุกขลิก ซึ่งเมนูใหม่นี้มีจำหน่ายถึงช่วงสงกรานต์ 2561 นี้นะคะ

Spicy Mazemen スパイシーまぜ麺
ราเมนรสเผ็ดแบบแห้งคลุกซอสสูตรเผ็ดขลุกขลิกแบบธรรมดา และแบบเพิ่มท็อปปิ้ง สดฉ่ำของอิคุระ (ไข่ปลาแซลมอน) ส่งตรงจากฮอกไกโด เก๋ตรงมีแค็บหมูให้ความกรุบกรอบเข้ากันดีด้วยค่ะ ชามนี้กินแล้วต้องบอกว่าถูกใจคนไทยแน่นอน เพราะความที่มีรสเผ็ด ทำให้กินได้เรื่อยๆ จนหมดชาม

Truffle Mazemen with Cheese トリュフチーズまぜ麺
ราเมนเส้นเล็กแบบแห้งได้ กลิ่นหอมที่มีเอกลักษณ์เฉพาะของเห็ดทรัฟเฟิล และชีส (จำกัดเสิร์ฟ 15 ชามต่อวัน) จานนี้ให้ความรู้สึกเหมือนสปาเก็ตตี้ แบบครีมมี่ดีงาม เหมาะกับคนชอบรสชาติสไตล์อินเตอร์ค่ะ

อ่ะลอง Signature อีกสัก 1 เมนูค่ะ
Shio Ramen ราเมนซุปใส เสิร์ฟพร้อมอกไก่ชาชู หมูชาชู หน่อไม้ แผ่นสาหร่าย เส้นของชามนี้เป็นแบบเส็นเล็ก น้ำซุปใสแต่รสชาติแน่น กลมกล่อม ชามนี้เหมาะกับทุกคนได้เลยค่ะ

ยังไม่หมด มาแล้วก็ต้องลองขนมใหม่ พึ่งขายได้ไม่กี่วัน Hokkaido Milk Crème Brulee เนื้อละมุน หอม หน้ากรอบ ก้นถ้วยมีสตอเบอร์รี้ด้วย เป็นขนม Homemade ที่ดีงามจริงๆ ไม่หวานเกินไปด้วยค่ะ อย่าลืมมาลองกัน

เครื่องดื่มแนะนำยูสุโซดา เปรี้ยว และ ซ่า สดชื่นดีค่ะ

ใครที่ชอบกินราเมง อย่าลืมไปลองกัน คุ้มค่ากับความอร่อยแน่นอน ไม่ต้องบินไปถึงโตเกียวไปต่อคิวกิน มากินที่นี่ก็อิน ก็ฟินสุดๆ ได้จ้า","จุดเด่น,เส้น,Homemade,น้ำ,ซุป,สูตร,แน่นอน,ลอง,Signature,นะคะ,Tsukemen,ป้าย,วิธี,กิน,อ่ะ,เมนู,Chashu,Itto,Tsukemen,เสิร์ฟ,แยกกัน,ซุป,เส้น,ตัว,เส้น,ลักษณะ,หนา,นุ่ม,Topping,ชาม,ไก่,ชาชู,หมู,ชาชู,หมูสามชั้น,แผ่น,สาหร่าย,น้ำ,ซุป,ดู,เข้มข้น,ลูกชิ้น,ไก่,สับ,กระดูกอ่อน,ชิ้น,เวลา,กิน,จุ่ม,เส้น,น้ำ,ซุป,เข้มข้น,เติม,น้ำ,ซุป,โต๊ะ,โต๊ะ,น้ำ,ซุป,"",Wadashi,"",เอาไว้,เติม,ท็อป,ปิ้ง,เลือก,สั่ง,แน่นอน,สั่ง,Tamako,ไข่ต้ม,แช่,ซอส,ใส่,ชาม,ราเมง,ชิม,ฟิน,Signature,น้ำ,ซุป,รส,เข้มข้น,ชาม,ลอง,เมนู,"",Mazemen,"",รสชาติ,ราเมน,โฮมเมด,เส้น,เหนียว,นุ่ม,สไตล์,เม,นยะ,อิต,คลุก,ซอส,สูตร,พิเศษ,ขลุกขลิก,เมนู,จำหน่าย,สงกรานต์,นะคะ,Spicy,Mazemen,スパイシーまぜ麺,ราเมน,รส,เผ็ด,แห้ง,คลุก,ซอส,สูตร,เผ็ด,ขลุกขลิก,ธรรมดา,ท็อป,ปิ้ง,สด,ฉ่ำ,อิ,คุ,ระ,ไข่ปลา,แซลมอน,ฮอกไกโด,เก๋,แค็บ,หมู,กรุบ,กรอบ,เข้ากัน,ดี,ชาม,กิน,บอ,ถูกใจ,คนไทย,แน่นอน,มีรส,เผ็ด,กิน,ชาม,Truffle,Mazemen,with,Cheese,トリュフチーズまぜ麺,ราเมน,เส้น,แห้ง,กลิ่นหอม,เอกลักษณ์,เห็ด,ทรัฟเฟิล,ชีส,จำกัด,เสิร์ฟ,ชาม,จาน,ความรู้สึก,เหมือน,สปา,เก็ตตี้,ครีม,มี่,ดีงาม,เหมาะกับ,คน,ชอบ,รสชาติ,สไตล์,อินเตอร์,อ่ะ,ลอง,Signature,สัก,เมนู,Shio,Ramen,ราเมน,ซุป,ใส,เสิร์ฟ,อกไก่,ชาชู,หมู,ชาชู,หน่อไม้,แผ่น,สาหร่าย,เส้น,ชาม,เส็น,น้ำ,ซุป,ใส,รสชาติ,แน่น,กลมกล่อม,ชาม,เหมาะกับ,แล้วก็,ลอง,ขนม,ขาย,กี่,Hokkaido,Milk,Cr,è,me,Brulee,เนื้อ,ละมุน,หอม,หน้า,กรอบ,ก้น,ถ้วย,สตอ,เบอร์,รี้,ขนม,Homemade,ดีงาม,หวาน,เกินไป,อย่า,ลืม,ลอง,เครื่องดื่ม,แนะนำ,ยู,สุ,โซดา,เปรี้ยว,ซ่า,สดชื่น,ดี,ชอบ,กิน,ราเมง,อย่า,ลืม,ลอง,คุ้มค่า,อร่อย,แน่นอน,ไม่ต้อง,บิน,โตเกียว,คิว,กิน,กิน,ที่นี่,อิน,ฟิน",0,0.9997916,foodie review,5
13,"Ramen เจ้าดัง แต่ยังไม่ค่อยปังเท่าไร
ร้านนี้ มีเมนูราเมนหลักๆ 3อย่าง วันนี้มาลองสั่ง ครบเลย 3อย่าง
-อันแรก tsukemen อันนี้รสชาติถือว่าดีสุดใน 3 ชามที่สั่งมา น้ำเข้มข้น แต่ ยังไม่ปังเท่าร้านอื่น (เอาเป็นว่าถูกปากน้อยสุดในบรรดาร้านที่เคยทานมาเลย)
-ชามที่สอง จำชื่อไม่ได้ แต่เป็นซุบไก่ น้ำซุบจะเหลืองอ่อนๆดูใสๆทานแล้วรู้สึกธรรมดา แต่ได้กลิ่นซุบไก่ขึ้นจมูกเลยทีเดียว รู้สึกไม่ค่อยเหมือนราเมนญี่ปุ่นเท่าไหร่ เพราะปกติ ไม่น้ำซุบหมูก็ซุบปลา
-ชามที่สาม ซุบเกลือ อันนี้ด้อยสุดใน 3ชามที่สั่งมา ค่อยข้างเค็ม แต่ถ้าใครชอบแนวเค็มๆเกลือๆก็ไปลองกันได้นะครับ แต่ส่วนตัวไม่ถนัดแนวนี้
-หมูชาชู ที่นี่ หนา นุ่ม อันนี้ชมนะ อร่อยครับ
-เกี๊ยวซ่า ก็พอได้ พื้นๆครับ
สุดท้ายเรื่องราคาค่อนข้างสูงโดย tsukemen 300 กว่า++ ส่วนอีก2ชาม ชามละ 200กว่าๆ++เช่นกัน","Ramen,เจ้า,ปัง,เมนู,ราเมน,หลัก,ลอง,สั่ง,tsukemen,อันนี้,รสชาติ,ดี,ชาม,สั่ง,น้ำ,เข้มข้น,ปัง,เอาเป็นว่า,ถูกปาก,บรรดา,ทาน,ชาม,ที่สอง,ชื่อ,ซุบ,ไก่,น้ำ,ซุบ,เหลือง,อ่อน,ดู,ใส,ทาน,รู้สึก,ธรรมดา,ได้กลิ่น,ซุบ,ไก่,จมูก,รู้สึก,เหมือน,ราเมน,ญี่ปุ่น,ปกติ,น้ำ,ซุบ,หมู,ซุบ,ปลา,ชาม,ที่สาม,ซุบ,เกลือ,อันนี้,ด้อย,ชาม,สั่ง,เค็ม,ชอบ,แนว,เค็ม,เกลือ,ลอง,ส่วนตัว,ถนัด,แนว,หมู,ชาชู,ที่นี่,หนา,นุ่ม,อันนี้,ชม,อร่อย,เกี๊ยวซ่า,พอได้,สุดท้าย,เรื่อง,ราคา,tsukemen,ชาม,ชา,มละ,ๆ++",1,0.99922985,ramen lover,3
14,"รสชาติญี่ปุ่นๆแท้ 
ร้านราเมนชื่อดังจากญี่ปุ่น บอกเลยไม่ได้ทำการบ้านมาหรอก แม้ว่าส่วนตัวจะชอบกินราเมนแต่ไม่ใช่แฟนคลับชนิดที่ร้านไหนเด็ดดังต้องตามไปกินขนาดนั้น

ส่วนร้านนี้เห็นฮือฮาตั้งแต่แรกๆที่มาเปิด คนก็เห่อกันตามประสารอคิวยันดึกดื่น(เห็นน้องในเฟสคอยอยู่) มื้อนี้ได้มีโอกาสทานเพราะออกไปทำงานข้างนอก ร้านอยู่ในโรงแรมเอราวัณ ราชประสงค์ ชั้นที่มีอาหารเยอะๆ

ตัวร้านตกแต่งแบบญี่ปุ่นๆ มีทั้งนั่งโต๊ะและเคาน์เตอร์ บาร์ เมนูมีแต่ราเมน เพิ่มมาหน่อยเป็นผักลวกและเกี๊ยวซ่า ชาเขียวมีแบบรีฟิล แก้วละ 50 บาท

Itto Noko Gyokai Ramen - เรากินอันนี้ ในเมนูมีสามชั้น แฮม อกไก่ ความรู้สึกแรกที่เข้าปากคือเข้มข้นจนเค็ม รสชาติญี่ปุ่นแท้แบบที่ถ้าคนชอบคือชอบเลยนะ ไม่ชอบคือเลี่ยนมาก เราว่าที่เราได้กินนี่ค่อยไปทางเลี่ยนๆมากกว่า ก็ทานได้แต่ไม่ได้ว้าว ประทับใจขนาดนั้น ส่วนเนื้อสัตว์โอเค อร่อยอยู่ นุ่มมาก ไก่นี่นุ่มจนเหมือนไม่ใช่ไก่ เส้นราเมนกลางๆ ราคาต่อชามสูงมาก มาทานเองคงไม่สเป็คอ่ะ

เกี๊ยวซ่า - อร่อยดี ไส้กลมกล่อม มันนิดหน่อยแต่ไม่มาก

เมนูอื่นๆที่ถ่ายมาเป็นของพี่ๆ ลองชิมดูก็พอว่าแบบแยกเส้น แยกน้ำจะอร่อยกว่าเพราะไม่เค็ม ไม่เลี่ยนเท่าแบบที่ใส่น้ำมาเลย

ส่วนตัวก็กินให้รู้ คนที่ชอบแบบนี้ก็มี แต่เราไม่ได้ชอบแบบนี้จ้า มาลองเองดีกว่า...อย่าเพิ่งเชื่อใคร ","รสชาติ,ญี่ปุ่น,ราเมน,ชื่อดัง,ญี่ปุ่น,ทำการบ้าน,หรอก,ส่วนตัว,ชอบ,กิน,ราเมน,แฟนคลับ,ชนิด,เด็ด,ต้องตาม,กิน,ขนาด,ฮือฮา,ตั้งแต่แรก,ที่มา,คน,เห่อ,ตามประสา,รอ,คิว,ยัน,ดึกดื่น,น้อง,เฟส,คอย,มื้อ,มีโอกาส,ทาน,ทำงาน,ข้างนอก,โรงแรม,เอราวัณ,ราชประสงค์,ชั้น,อาหาร,ตัว,ตกแต่ง,ญี่ปุ่น,นั่ง,โต๊ะ,เคาน์เตอร์,บาร์,เมนู,ราเมน,ผัก,ลวก,เกี๊ยวซ่า,ชาเขียว,รี,ฟิล,แก้ว,Itto,Noko,Gyokai,Ramen,กิน,อันนี้,เมนู,สามชั้น,แฮม,อกไก่,ความรู้สึก,ปาก,เข้มข้น,เค็ม,รสชาติ,ญี่ปุ่น,คน,ชอบ,ชอบ,ชอบ,เลี่ยน,ว่าที่,กิน,เลี่ยน,ทาน,ว้าว,ประทับใจ,ขนาด,เนื้อสัตว์,โอเค,อร่อย,นุ่ม,ไก่,นุ่ม,เหมือน,ไก่,เส้น,ราเมน,กลางๆ,ราคา,ชาม,ทาน,สเป็ค,อ่ะ,เกี๊ยวซ่า,อร่อย,ดี,ไส้,กลมกล่อม,เมนู,ถ่าย,พี่,ลอง,ชิม,ดู,แยก,เส้น,แยก,น้ำ,อร่อย,เค็ม,เลี่ยน,ใส่,น้ำ,ส่วนตัว,กิน,รู้,คน,ชอบ,แบบนี้,ชอบ,แบบนี้,ลอง,ดีกว่า,...,อย่า",1,0.9995097,ramen lover,3
