review_id,review,review_tokenized,topic,score,topic_title,rating
20,"กลับไปซ้ำแน่นอน
ร้านราเมงชื่อดัง ต้องห้ามพลาด
ปกติเป็นคนไม่ชอบราเมงเค็มแต่ก็ต้องมาลองดู

กลัวคิวเยอะ แต่ตอนที่มาประมาณบ่ายโมงวันพุธ ไม่มีคิวเลย เข้าไปนั่ง สั่งอาหาร ไม่นานก็มา ฟิน

ราเมงที่สั่งคือ tsukemen original
มีหมู1แผ่น (ถ้าเป็นในรูปที่มี3ชิ้น จะมีไก่กับสามชั้นเพิ่มมา)

ซุปราเมงเค็มมากจริงๆ แต่เค้ามีน้ำซุปจืดๆให้เติมตามใจชอบ

เส้นของที่นี่ต้องยอมจริงๆ มันอวบมันfirmมันดีมาก ตรงเสป้คมากๆ

เส้นเย็นรีบไปจุ่มในซุปแล้วซู้ดเข้าปาก อร่อยลืมเค็ม

จะต้องกลับไปอีกแน่ๆ เส้นราเมงร้านนี้ลืมไม่ลงจริงๆ","ซ้ำ,แน่นอน,ราเมง,ชื่อดัง,ต้องห้าม,พลาด,ปกติ,คน,ชอบ,ราเมง,เค็ม,ลองดู,กลัว,คิว,ตอน,ที่มา,บ่ายโมง,พุธ,คิว,เข้าไป,นั่ง,สั่งอาหาร,ฟิน,ราเมง,สั่ง,tsukemen,original,หมู,แผ่น,รูป,ชิ้น,ไก่,สามชั้น,ซุป,ราเมง,เค็ม,เค้า,น้ำ,ซุป,จืด,เติม,ตามใจชอบ,เส้น,ที่นี่,อวบ,firm,ดีมาก,เส,ป้ค,เส้น,เย็น,รีบ,จุ่ม,ซุป,ซู้ด,ปาก,อร่อย,ลืม,เค็ม,แน่ๆ,เส้น,ราเมง,ลืม",0,0.9991245,foodie review,5
21,"ซุปดี เส้นใช้ได้ แต่ชาชูยังไม่โดนนะจ๊ะ
เมนูเด็ด: Chashu Noko Gyokai Ramen, Tokusei Shio Ramen
ร้านดังอันดับ1จากญี่ปุ่น ทำเส้นสด ซุปเบสเป็นซุปไก่ผสมของทะเล กลิ่นปลาหอมฟุ้ง รสไม่หนักแบบซุปกระดูกหมู โดดเด่นที่ใช้การทำชาชูด้วยวิธีแบบSous Vide ที่ช่วยคงความฉ่ำของเนื้อสัตว์ไว้ได้ดี แต่ทำออกมารสชาติอ่อนและขาดความหอมแบบวิธีดั้งเดิมไป เราเลือกชิมราเมงซุปเกลือ เส้นเล็ก ไม่เค็มมากเสริฟพร้อมซอสXO ส่วนราเมงแบบจุ่มเส้นที่เป็นSignature เส้นใหญ่หนึบไม่มากเสริฟเส้นเย็น ซุปร้อนค่อนข้างเค็มแต่ไม่เกาะเส้น รสน้ำซุปเลยไม่ติดเส้นเท่าที่ควร ในน้ำซุปมีลูกชิ้นไก่อร่อยมากแต่ระวังร้อนมากเช่นกัน มีพริกป่นมาให้เติมแก้เลี่ยน ทานไปซักระยะซุปจะเย็นทำให้รสเค็มชัดขึ้น ใครไม่ชอบเค็มมีน้ำซุปให้เติมแต่จะทำให้รสซุปจางเกินไป สั่งเกี๊ยวซ่าหมูอร่อยดีค่ะ โดยรวม รสชาติเบาๆไม่แน่นแบบซุปกระดูกหมู ออกแนวเฮลตี้หน่อย ความอร่อยเลยยังไม่โดนใจเราค่ะ","ซุป,ดี,เส้น,ใช้ได้,ชาชู,โดน,นะจ๊ะ,เมนู,เด็ด,Chashu,Noko,Gyokai,Ramen,,,Tokusei,Shio,Ramen,อันดับ,ญี่ปุ่น,ทำ,เส้น,สด,ซุป,เบส,ซุป,ไก่,ผสม,ทะเล,กลิ่น,ปลา,หอม,ฟุ้ง,รส,หนัก,ซุป,กระดูก,หมู,โดดเด่น,ใช้การ,ทำ,ชาชู,วิธี,Sous,Vide,ฉ่ำ,เนื้อสัตว์,ได้ดี,ทำ,ออกมา,รสชาติ,อ่อน,หอม,วิธี,ดั้งเดิม,เลือก,ชิม,ราเมง,ซุป,เกลือ,เส้น,เค็ม,เส,ริ,ฟ,ซอส,XO,ราเมง,จุ่ม,เส้น,Signature,เส้นใหญ่,หนึบ,เส,ริ,ฟ,เส้น,เย็น,ซุป,ร้อน,เค็ม,เกาะ,เส้น,รส,น้ำ,ซุป,ติด,เส้น,เท่าที่ควร,น้ำ,ซุป,ลูกชิ้น,ไก่,อร่อย,ระวัง,ร้อน,พริกป่น,เติม,แก้,เลี่ยน,ทาน,ซัก,ซุป,เย็น,รสเค็ม,ชัด,ชอบ,เค็ม,น้ำ,ซุป,เติม,รส,ซุป,จาง,เกินไป,สั่ง,เกี๊ยวซ่า,หมู,อร่อย,ดี,โดยรวม,รสชาติ,เบา,แน่น,ซุป,กระดูก,หมู,แนว,เฮลตี้,อร่อย,โดนใจ",0,0.9995786,foodie review,3
22,"Ramen ที่อยากลองมานาน
เห็นใครๆ ก็รีวิวร้านราเมนนี้มานานหลายเดือนมาก
วันนี้บังเอิญ ร้านมาเปิดบูทที่พารากอน รอแป๊ปเดียวก้อได้ละ เลยขอลองซะหน่อย 
สั่งเลยค่ะ ต้นตำรับของร้าน ราคา 350฿ มาแบบ เส้นราเมนหนาแบบเย็นโปะด้วยหมูรมควัน และน้ำซุปร้อนเคี่ยวเหนียวพร้อมให้จุ่มเส้น แต่รสชาติ น้ำซุปเค็มมาก ยิ่งกินไปน้ำซุปเริ่มหายร้อน ยิ่งเค็มมาก
ส่วนแฟน เป็นราเมนแบบธรรมดา 230฿ เส้นราเมนจะเล็กกว่า นำ้ซุปเค็มมากอีกแล้วค่ะ แฟนบ่นตั้งแต่คำแรกจนคำสุดท้าย  แต่ยังดีหมูชามนี้อร่อยซึ่งแฟนไม่ชอบ
สรุป 580฿ ครั้งนี้เป็นครั้งแรก และคงเป็นครั้งเดียวจริงๆ","Ramen,ลอง,รีวิว,ราเมน,เดือน,บังเอิญ,บูท,พารากอน,รอ,แป๊ป,ก้อ,ลอง,สั่ง,ต้นตำรับ,ราคา,เส้น,ราเมน,หนา,เย็น,โปะ,หมู,รมควัน,น้ำ,ซุป,ร้อน,เคี่ยว,เหนียว,จุ่ม,เส้น,รสชาติ,น้ำ,ซุป,เค็ม,กิน,น้ำ,ซุป,หาย,ร้อน,เค็ม,แฟน,ราเมน,ธรรมดา,เส้น,ราเมน,นำ้,ซุป,เค็ม,อีกแล้ว,แฟน,บ่น,สุดท้าย,  ,ดี,หมู,ชาม,อร่อย,แฟน,ชอบ,สรุป,เป็นครั้งแรก",1,0.99892235,ramen lover,2
23,ราเมงอร่อย สะอาด ,"ราเมง,อร่อย,สะอาด",0,0.0112743545,foodie review,5
24,เส้นจะมีความแข็งมากกว่าที่อื่น รสชาติจะออกไปทานเค็ม มาก ไปหน่อย,"เส้น,ความแข็ง,ที่อื่น,รสชาติ,ทาน,เค็ม",0,0.9909305,foodie review,3
25,"เมนู: ShioRamen, ไข่มะตูม
เส้นเหนียวนุ่ม รสชาติเข้มข้นกำลังดี
อยู่ใกล้รถไฟฟ้าชิดลม เดินทางสะดวก
มารอบสองแล้วก็ยังประทับใจในรสชาติ","เมนู,ShioRamen,,,ไข่,มะตูม,เส้น,เหนียว,นุ่ม,รสชาติ,เข้มข้น,กำลังดี,รถไฟฟ้า,ชิด,ลม,เดินทาง,สะดวก,รอบ,สอง,แล้วก็,ประทับใจ,รสชาติ",1,0.99706835,ramen lover,4
26,"Shio Ramen เข้มข้นด้วยรสไก่
วันก่อนมีธุระแถว Erawan เลยไปลองทานซ้ำอีกรอบ แต่คราวนี้สั่ง Shio Ramen แทน

น้ำซุปใส เข้มข้นไปด้วยรสชาติของไก่ เส้นลวกมาแข็งกำลังดี นับว่าดีขึ้นเยอะกว่าตอนมาครั้งแรก

แต่ตกม้าตายตรงขนมหวาน creme brulee เนื้อแห้งแข็ง พร้อม strawberry compote ที่ก้นขวดซึ่งไม่ได้เข้ากัน ผิดหวังครับ
ราคา: ราวๆ 300 บาทต่อคน

ส่วนตัวให้ 3 ดาวยังเฉยๆอยู่","Shio,Ramen,เข้มข้น,รส,ไก่,วันก่อน,มีธุระ,แถว,Erawan,ลอง,ทาน,ซ้ำ,อี,กรอบ,สั่ง,Shio,Ramen,แทน,น้ำ,ซุป,ใส,เข้มข้น,รสชาติ,ไก่,เส้น,ลวก,แข็ง,กำลังดี,นับว่า,ดีขึ้น,ตอน,ครั้งแรก,ตกม้าตาย,ขนมหวาน,creme,brulee,เนื้อ,แห้ง,แข็ง,strawberry,compote,ก้น,ขวด,เข้ากัน,ผิดหวัง,ราคา,ราวๆ,คน,ส่วนตัว,ดาว",0,0.9988973,foodie review,3
27,"ซุปข้น (ทรัพย์จาง)
มาทานเป็นครั้งที่2 และลองทานเป็นแบบราเมงทั่วไปดูบ้าง และสั่งเกี๊ยวซ่ามาชิมด้วย
เริ่มทานแรกๆก็รู้สึกอร่อยดี ซุปเข้มข้นมันดี เส้นนุ่ม อกไก่ หมูชาชูหอมดี แต่พอทานไปสักพักชักเลี่ยนค่ะ แหะๆ คงเพราะรสชาติมันเข้ม&มันมากและไม่มีรสอื่นมาตัด ส่วนตัวชอบแบบที่แยกน้ำซุปมากกว่าค่ะ

มื้อนี้สั่งราเมง2ชาม สั่งเนื้อสัตว์เพิ่ม1จาน(6ชิ้น) และเกี๊ยวซ่า1จาน. ราคารวม900++ค่ะ ","ซุป,ข้น,ทรัพย์,จาง,ทาน,ลอง,ทาน,ราเมง,ไปดู,สั่ง,เกี๊ยวซ่า,ชิม,ทาน,รู้สึก,อร่อย,ดี,ซุป,เข้มข้น,มันดี,เส้น,นุ่ม,อกไก่,หมู,ชาชู,หอ,มดี,ทาน,สักพัก,ชัก,เลี่ยน,แหะๆ,รสชาติ,เข้ม,&,มีรส,ตัด,ส่วนตัว,ชอบ,แยก,น้ำ,ซุป,มื้อ,สั่ง,ราเมง,ชาม,สั่ง,เนื้อสัตว์,จาน,ชิ้น,เกี๊ยวซ่า,จา,น.,ราคา",0,0.9989596,foodie review,3
28,"ราเมนซุปไก่ รสชาติดีใช้ได้
ร้านอยู่ชั้นใต้ดินของเอราวัณ หาง่าย
สึเคเมน เส้นแข็งไปนิด อันนี้แล้วแต่คนชอบ
น้ำซุปอร่อยดี
ชิโอะราเมน น้ำซุปไก่ใส่เกลือ รสชาติดีใช้ได้ ค่นไปทางเค็ม เนื้อไก่ที่ให้มา เนื้อสัมผัสแปลกดี นุ่มเนียนแทบจะเหมือนไก่บด แต่กลับทำให้คิดถึงอกไก่ 7-11 เค้าจะเสียใจมั้ยนะ ที่คนกินคิดแบบนี้","ราเมน,ซุป,ไก่,รสชาติ,ดี,ใช้ได้,ชั้นใต้ดิน,เอราวัณ,หา,สึ,เค,เมน,เส้นแข็ง,อันนี้,คน,ชอบ,น้ำ,ซุป,อร่อย,ดี,ชิ,โอะ,ราเมน,น้ำ,ซุป,ไก่,ใส่,เกลือ,รสชาติ,ดี,ใช้ได้,ค่น,เค็ม,เนื้อไก่,เนื้อ,สัมผัส,แปลก,ดี,นุ่ม,เนียน,แทบจะ,เหมือน,ไก่,บด,แต่กลับ,คิดถึง,อกไก่,เค้า,เสียใจ,คน,กิน,แบบนี้",1,0.9987568,ramen lover,4
29,"อร่อยสมคำร่ำลือ
รีบไปจัด หลังจากที่พี่หยีคอนเฟิร์มว่าอร่อยค่ะ
ร้านเปิดช่วงเย็น18น ไปถึงหลังร้านเปิดแค่5นาที คนเต็มร้านเลยค่า แล้วก็ค่อยๆมาทยอยต่อคิวกัน
ที่จอดรถสบายๆ ในโรงแรมเอราวัณ
ร้านไม่ใหญ่ มาคนเดียวก็นั่งcounter คนมาทานหลังเลิกงานเยอะอยู่ค่ะ
ครั้งนี้มาลอง tsukemen ขึ้นชื่อของร้าน อร่อยจริงค่ะ แต่มันมากไปหน่อย พอดีสั่ง Scallop oilมาลองด้วย ยิ่งเพิ่มความมัน พริกป่นที่นี่ไม่เผ็ดเท่าไรค่ะ
ราคาก็ค่อนข้างแพงเลยค่ะ","อร่อย,สม,ร่ำ,ลือ,รีบ,หลังจากที่,พี่,หยี,คอนเฟิร์ม,อร่อย,เย็น,น,นาที,คน,เต็ม,ค่า,แล้วก็,ทยอย,คิว,ที่จอดรถ,โรงแรม,เอราวัณ,คนเดียว,นั่ง,counter,คน,ทาน,เลิกงาน,ลอง,tsukemen,ขึ้นชื่อ,อร่อย,สั่ง,Scallop,oil,ลอง,ความมัน,พริกป่น,ที่นี่,เผ็ด,ราคา,แพง",2,0.99857086,user experiances,5
30,"ร้านราเม็งชื่อดังจากญีปุ่่นมาเปิดสาขาควรลอง
ราคาต่อหัว: 251 - 500 บาท
Menya Ittou เป็นร้านราเม็งดังที่ได้รางวัลมากมายจากที่โตเกียวครับ โดยร้านออริจินอลไปทานแต่ละทีต้องต่อคิวยาวเป็น ชม เลย มาเปิดสาขากลางเมืองบ้านเราแล้วสะดวกขึ้นมาก ตัวเด่นของร้านยังคงเป็น Tsukemen เหมือนเดิม เครื่องทั้ง 3 ที่ทอปมาอร่อยเช่นของเดิม ยังมีดาชิไว้ให้เทลงซุปซดทานได้ด้วย แต่แอบรู้สึกว่าน้ำไม่เข้มข้นเท่าที่โน่นนิดนึง แต่โดยรวมคือดีงามครับ ใครชอบทาน Tsukemen ควรลอง ","ราเม็ง,ชื่อดัง,ญีปุ่่น,สาขา,ลอง,ราคา,Menya,Ittou,ราเม็ง,ดังที่,รางวัล,โตเกียว,ร้า,นอ,อริ,จิ,นอ,ล,ทาน,คิว,ชม,สาขา,กลางเมือง,บ้าน,สะดวก,ตัว,เด่น,Tsukemen,เหมือนเดิม,เครื่อง,ทอ,ป,อร่อย,เดิม,ยังมี,ดา,ชิ,เท,ซุป,ซด,ทาน,แอบ,รู้สึก,น้ำ,เข้มข้น,ที่โน่น,นิดนึง,โดยรวม,ดีงาม,ชอบ,ทาน,Tsukemen,ลอง",0,0.9989596,foodie review,5
